{
  "$schema": "./remote-agent.config.schema.json",
  "schemaVersion": 2,
  "serviceName": "remote-agent",
  "machine": {
    "id": "studio-mac",
    "name": "Studio Mac",
    "server": {
      "publicUrl": "https://agents.example.com",
      "apiKey": "replace-with-a-long-random-api-key",
      "listen": {
        "host": "127.0.0.1",
        "port": 9000
      },
      "databaseUrl": "file:./remote-agent.sqlite",
      "acpSocketPath": "~/Library/Application Support/remote-agent/acp.sock",
      "controlSocketPath": "~/Library/Application Support/remote-agent/control.sock"
    },
    "acpx": {
      "stateDir": "~/Library/Application Support/remote-agent/acpx",
      "maxConcurrentTurns": 3
    },
    "acp": {
      "providerId": "codex"
    },
    "installation": {
      "gitRemote": "https://github.com/brandonisagoon/remote-agent.git",
      "branch": "main"
    },
    "updates": {
      "channel": "stable"
    }
  },
  "routing": {
    "ingress": false,
    "receiverOnly": false,
    "peers": {},
    "connectionHosts": {}
  },
  "providers": {
    "codex": {},
    "claude": {}
  },
  "connections": {
    "linear-main": {
      "provider": "linear",
      "name": "Linear Product",
      "apiKey": {
        "type": "app",
        "clientId": "replace-with-linear-app-client-id",
        "clientSecret": "replace-with-linear-app-client-secret"
      },
      "agentUserId": "replace-with-linear-agent-user-id",
      "agentHandle": "agent",
      "webhook": {
        "slug": "linear-product",
        "secret": "replace-with-linear-webhook-secret",
        "webhookMaxAgeMs": 60000
      },
      "router": {
        "providerId": "codex",
        "timeoutMs": 30000
      },
      "editors": [
        {
          "name": "Zed",
          "scheme": "zed"
        }
      ],
      "machineId": "studio-mac",
      "repositories": "*"
    }
  },
  "repositories": {
    "your-repository": {
      "name": "Your Repository",
      "root": "~/checkouts/your-repository",
      "worktreeRoot": "../.worktrees/your-repository",
      "worktreeNaming": {
        "*": "{branch}"
      }
    }
  }
}
